Name,Age,Hometown,Country,Boarded,Destination,Lifeboat,Class,Survive,Title,CountryBin,AgeBin,FamilySize,isAlone,AgeBin_Code,CountryBin_Code,Title_Code
"Shelley, Mrs. Imanita (née Parrish Hall)",25,"Deer Lodge, Montana, US",US,Southampton,"Deer Lodge, Montana, US",1,2,1,Mrs,US,young adults,1,1,3.0,4.0,7.0
"Silvén, Miss Lyyli Karolina",17,"Tornio, Grand Duchy of Finland[note 7]",Grand Duchy of Finland,Southampton,"Minneapolis, Minnesota, US",1,2,1,Miss,Other,minors,1,1,1.0,0.0,5.0
"Sincock, Miss Maude",20,"St. Ives, Cornwall, England",UK,Southampton,"Hancock, Michigan, US",1,2,1,Miss,UK,young adults,1,1,3.0,3.0,5.0
"Sinkkonen, Miss Anna",30,"Turku, Grand Duchy of Finland[note 7]",Grand Duchy of Finland,Southampton,"Brighton, Boston, Massachusetts, US",1,2,1,Miss,Other,young adults,1,1,3.0,0.0,5.0
"Sjöstedt, Mr. Ernst Adolf",30,"Hjo, Västergötland, Sweden",Sweden,Southampton,"Sault Ste Marie, Michigan, US",1,2,1,Mr,Sweden,young adults,1,1,3.0,1.0,6.0
"Slayter, Miss Hilda Mary",30,"Halifax, Nova Scotia, Canada",Canada,Queenstown,"Vancouver, British Columbia, Canada",1,2,1,Miss,Other,young adults,1,1,3.0,0.0,5.0
"Slemen, Mr. Richard James",35,"Landrake, Cornwall, England",UK,Southampton,"Nashua, New Hampshire, US",0,2,0,Mr,UK,adults,1,1,0.0,3.0,6.0
"Smith, Miss Marion Elsie",39,"Basingstoke, Hampshire, England",UK,Southampton,"Washington, DC US",1,2,1,Miss,UK,adults,1,1,0.0,3.0,5.0
"Sobey, Mr. Samuel James Hayden",25,"Porthallow, Cornwall, England",UK,Southampton,"Houghton, Michigan, US",0,2,0,Mr,UK,young adults,1,1,3.0,3.0,6.0
"Stanton, Mr. Samuel Ward",42,New York City,US,Southampton,New York City,0,2,0,Mr,US,adults,1,1,0.0,4.0,6.0
"Stokes, Mr. Philip Joseph",25,"London, England",UK,Southampton,"Detroit, Michigan, US",0,2,0,Mr,UK,young adults,1,1,3.0,3.0,6.0
"Sweet, Mr. George Frederick",14,"Yeovil, Somerset, England",UK,Southampton,"Bernardsville, New Jersey, US",0,2,0,Mr,UK,minors,1,1,1.0,3.0,6.0
"Taylor, Mr. Percy Cornelius[72]",32,"London, England",UK,Southampton,New York City,0,2,0,Mr,UK,adults,1,1,0.0,3.0,6.0
"Toomey, Miss Ellen Mary",48,"Indianapolis, Indiana, US",US,Southampton,"Indianapolis, Indiana, US",1,2,1,Miss,US,adults,1,1,0.0,4.0,5.0
"Troupiansky, Mr. Moses Aaron",23,"London, England",UK,Southampton,New York City,0,2,0,Mr,UK,young adults,1,1,3.0,3.0,6.0
"Trout, Mrs. Jessie L.",26,"Columbus, Ohio, US",US,Southampton,"Columbus, Ohio, US",1,2,1,Mrs,US,young adults,1,1,3.0,4.0,7.0
"Troutt, Miss Edwina Celia ""Winnie""",27,"Bath, Somerset, England",UK,Southampton,"Auburndale, Massachusetts, US",1,2,1,Miss,UK,young adults,1,1,3.0,3.0,5.0
"Turpin, Mr. William John Robert",29,"Plymouth, Devon, England",UK,Southampton,"Salt Lake City, Utah, US",0,2,0,Mr,UK,young adults,2,0,3.0,3.0,6.0
"Turpin, Mrs. Dorothy Ann (née Wonnacott)",27,"Plymouth, Devon, England",UK,Southampton,"Salt Lake City, Utah, US",0,2,0,Mrs,UK,young adults,2,0,3.0,3.0,7.0
"Veal, Mr. James",40,"Barre, Vermont, US",US,Southampton,"Barre, Vermont, US",0,2,0,Mr,US,adults,1,1,0.0,4.0,6.0
"Wallcroft, Miss Ellen ""Nellie""",36,"Maidenhead, Berkshire, England",UK,Southampton,"Mamaroneck, New York, US",1,2,1,Miss,UK,adults,1,1,0.0,3.0,5.0
"Ware, Mr. John James",45,"Bristol, Avon, England",UK,Southampton,"New Britain, Connecticut, US",0,2,0,Mr,UK,adults,3,0,0.0,3.0,6.0
"Ware, Mrs. Florence Louise (née Long)",31,"Bristol, Avon, England",UK,Southampton,"New Britain, Connecticut, US",1,2,1,Mrs,UK,adults,3,0,0.0,3.0,7.0
"Ware, Mr. William Jeffery",23,"Gunnislake, Cornwall, England",UK,Southampton,"Butte, Montana, US",0,2,0,Mr,UK,young adults,3,0,3.0,3.0,6.0
"Watson, Mr. Ennis Hastings[72]",15,"Belfast, Ireland, UK",UK,Belfast,New York City,0,2,0,Mr,UK,minors,1,1,1.0,3.0,6.0
"Watt, Mrs. Elizabeth Inglis ""Bessie"" (née Milne)",40,"Aberdeen, Aberdeenshire, Scotland",UK,Southampton,"Portland, Oregon, US",1,2,1,Mrs,UK,adults,2,0,0.0,3.0,7.0
"Watt, Miss Robertha Josephine ""Bertha""",12,"Aberdeen, Aberdeenshire, Scotland",UK,Southampton,"Portland, Oregon, US",1,2,1,Miss,UK,minors,2,0,1.0,3.0,5.0
"Webber, Miss Susan",37,"Bude, Cornwall, England",UK,Southampton,"Hartford, Connecticut, US",1,2,1,Miss,UK,adults,1,1,0.0,3.0,5.0
"Weisz, Mr. Leopold",28,"Bromsgrove, Worcestershire, England",UK,Southampton,"Montreal, Quebec, Canada",0,2,0,Mr,UK,young adults,2,0,3.0,3.0,6.0
"Weisz, Mrs. Mathilde Françoise (née Pëde)",37,"Bromsgrove, Worcestershire, England",UK,Southampton,"Montreal, Quebec, Canada",1,2,1,Mrs,UK,adults,2,0,0.0,3.0,7.0
"Wells, Mrs. Addie Dart (née Trevaskis)",29,"Heamoor, Cornwall, England",UK,Southampton,"Akron, Ohio, US",1,2,1,Mrs,UK,young adults,3,0,3.0,3.0,7.0
"Wells, Miss Joan",4,"Heamoor, Cornwall, England",UK,Southampton,"Akron, Ohio, US",1,2,1,Miss,UK,minors,3,0,1.0,3.0,5.0
"Wells, Master Ralph Lester",2,"Heamoor, Cornwall, England",UK,Southampton,"Akron, Ohio, US",1,2,1,Master,UK,minors,3,0,1.0,3.0,4.0
"West, Mr. Edwy Arthur",36,"Bournemouth, Dorset, England",UK,Southampton,"Gainesville, Florida, US",0,2,0,Mr,UK,adults,3,0,0.0,3.0,6.0
"West, Mrs. Ada Mary (née Worth)[74][93]",33,"Bournemouth, Dorset, England",UK,Southampton,"Gainesville, Florida, US",1,2,1,Mrs,UK,adults,3,0,0.0,3.0,7.0
"West, Miss Constance Mirium",4,"Bournemouth, Dorset, England",UK,Southampton,"Gainesville, Florida, US",1,2,1,Miss,UK,minors,3,0,1.0,3.0,5.0
"Wheadon, Mr. Edward H.",66,"Guernsey, Channel Islands",Channel Islands,Southampton,"Edgewood, Rhode Island, US",0,2,0,Mr,Other,seniors,1,1,2.0,0.0,6.0
"Wheeler, Mr. Edwin Charles ""Fred""",24,"Bath, Somerset, England",UK,Southampton,"Asheville, North Carolina, US",0,2,0,Mr,UK,young adults,1,1,3.0,3.0,6.0
"Whilems, Mr. Charles",32,"London, England",UK,Southampton,New York City,1,2,1,Mr,UK,adults,1,1,0.0,3.0,6.0
"Wilkinson, Miss Elizabeth Anne (alias Mrs. Elizabeth Faunthorpe)",29,"Manchester, England",UK,Southampton,"Philadelphia, Pennsylvania, US",1,2,1,Miss,UK,young adults,1,1,3.0,3.0,5.0
"Williams, Mr. Charles Eugene",23,"Harrow, London, England",UK,Southampton,"Chicago, Illinois, US",1,2,1,Mr,UK,young adults,1,1,3.0,3.0,6.0
"Woodward, Mr. John Wesley[72]",32,"Oxford, Oxfordshire, England",UK,Southampton,New York City,0,2,0,Mr,UK,adults,1,1,0.0,3.0,6.0
"Wright, Miss Marion",26,"Yeovil, Somerset, England",UK,Southampton,"Cottage Grove, Oregon, US",1,2,1,Miss,UK,young adults,1,1,3.0,3.0,5.0
"Yvois, Miss Henriette",24,"Paris, France",France,Southampton,"Montreal, Quebec, Canada",0,2,0,Miss,Other,young adults,1,1,3.0,0.0,5.0
"Abbing, Mr. Anthony",40,"Cincinnati, Ohio",US,Southampton,"Cincinnati, Ohio, US",0,3,0,Mr,US,adults,1,1,0.0,4.0,6.0
"Abbott, Mrs. Rhoda Mary (née Hunt)",39,"East Providence, Rhode Island",US,Southampton,"East Providence, Rhode Island, US",1,3,1,Mrs,US,adults,3,0,0.0,4.0,7.0
"Abbott, Mr. Rossmore Edward",16,"East Providence, Rhode Island",US,Southampton,"East Providence, Rhode Island, US",0,3,0,Mr,US,minors,3,0,1.0,4.0,6.0
"Abbott, Mr. Eugene Joseph",14,"East Providence, Rhode Island",US,Southampton,"East Providence, Rhode Island, US",0,3,0,Mr,US,minors,3,0,1.0,4.0,6.0
"Abd al-Khaliq, Mr. Farid Qasim Husayn",18,Shana,Syria,Cherbourg,New York City,0,3,0,Mr,Syria,minors,1,1,1.0,2.0,6.0
"Abelseth, Miss Karen Marie",16,Sunnmøre,Norway,Southampton,"Los Angeles, California, US",1,3,1,Miss,Other,minors,2,0,1.0,0.0,5.0
"Abelseth, Mr. Olaus Jørgensen",25,"Perkins County, South Dakota",US,Southampton,"Perkins County, South Dakota, US",1,3,1,Mr,US,young adults,2,0,3.0,4.0,6.0
"Abrahamsson, Mr. Abraham August Johannes",20,Dalsbruk,Finland,Southampton,"Hoboken, New Jersey, US",1,3,1,Mr,Other,young adults,1,1,3.0,0.0,6.0
"Abrahim, Mrs. Mary Sophie Halaut (née Easu)",18,Shwayhad,Syria,Cherbourg,"Greensburg, Pennsylvania, US",1,3,1,Mrs,Syria,minors,1,1,1.0,2.0,7.0
"Ådahl, Mr. Mauritz",30,"Asarum, Småland",Sweden,Southampton,"Brooklyn, New York, US",0,3,0,Mr,Sweden,young adults,1,1,3.0,1.0,6.0
"Adams, Mr. John",26,"Bournemouth, Dorset",UK,Southampton,"La Porte City, Iowa, US",0,3,0,Mr,UK,young adults,1,1,3.0,3.0,6.0
"Ahlin, Mrs. Johanna Persdotter (née Larsson)",40,"Göteborg, Västergötland",Sweden,Southampton,"Akeley, Minnesota, US",0,3,0,Mrs,Sweden,adults,1,1,0.0,1.0,7.0
"Aks, Mrs. Leah (née Rosen)",21,London,UK,Southampton,"Norfolk, Virginia, US",1,3,1,Mrs,UK,young adults,1,1,3.0,3.0,7.0
"Al-Muna, Mr. Nasif Qasim",26,"Fredericksburg, Virginia",US,Cherbourg,"Fredericksburg, Virginia, US",1,3,1,Mr,US,young adults,1,1,3.0,4.0,6.0
"Alexander, Mr. William",23,"Great Yarmouth, Norfolk",UK,Southampton,"Albion, Michigan, US",0,3,0,Mr,UK,young adults,1,1,3.0,3.0,6.0
"Alhomäki, Mr. Ilmari Rudolf",19,Salo,Finland,Southampton,"Astoria, Oregon, US",0,3,0,Mr,Other,young adults,1,1,3.0,0.0,6.0
"Ali, Mr. Ahmed",24,Buenos Aires,Argentina,Southampton,New York City,0,3,0,Mr,Other,young adults,2,0,3.0,0.0,6.0
"Ali, Mr. William",25,Buenos Aires,Argentina,Southampton,New York City,0,3,0,Mr,Other,young adults,2,0,3.0,0.0,6.0
"Allen, Mr. William Henry",35,"Birmingham, West Midlands",UK,Southampton,New York City,0,3,0,Mr,UK,adults,1,1,0.0,3.0,6.0
"Allum, Mr. Owen George",15,"Southall, London",UK,Southampton,New York City,0,3,0,Mr,UK,minors,1,1,1.0,3.0,6.0
"Al-Zainni, Mr. Fahim Ruhanna",22,Toula,Syria,Cherbourg,"Dayton, Ohio, US",1,3,1,Mr,Syria,young adults,1,1,3.0,2.0,6.0
"Andersen, Mr. Albert Karvin",33,Bergen,Norway,Southampton,New York City,0,3,0,Mr,Other,adults,1,1,0.0,0.0,6.0
"Andersen-Jensen, Miss Carla Christine",19,Eskilstrup,Denmark,Southampton,"Portland, Oregon, US",1,3,1,Miss,Other,young adults,1,1,3.0,0.0,5.0
"Andersson, Mr. Anders Johan",39,"Kisa, Östergötland",Sweden,Southampton,"Winnipeg, Manitoba, Canada",0,3,0,Mr,Sweden,adults,10,0,0.0,1.0,6.0
"Andersson, Mrs. Alfrida Konstantia (née Brogren)",39,"Kisa, Östergötland",Sweden,Southampton,"Winnipeg, Manitoba, Canada",0,3,0,Mrs,Sweden,adults,10,0,0.0,1.0,7.0
"Andersson, Miss Sigrid Elisabeth",11,"Kisa, Östergötland",Sweden,Southampton,"Winnipeg, Manitoba, Canada",0,3,0,Miss,Sweden,minors,10,0,1.0,1.0,5.0
"Andersson, Miss Ingeborg Constanzia",9,"Kisa, Östergötland",Sweden,Southampton,"Winnipeg, Manitoba, Canada",0,3,0,Miss,Sweden,minors,10,0,1.0,1.0,5.0
"Andersson, Miss Ebba Iris Alfrida",6,"Kisa, Östergötland",Sweden,Southampton,"Winnipeg, Manitoba, Canada",0,3,0,Miss,Sweden,minors,10,0,1.0,1.0,5.0
"Andersson, Master Sigvard Harald Elias",4,"Kisa, Östergötland",Sweden,Southampton,"Winnipeg, Manitoba, Canada",0,3,0,Master,Sweden,minors,10,0,1.0,1.0,4.0
"Andersson, Miss Ellis Anna Maria",2,"Kisa, Östergötland",Sweden,Southampton,"Winnipeg, Manitoba, Canada",0,3,0,Miss,Sweden,minors,10,0,1.0,1.0,5.0
"Andersson, Miss Erna Alexandra",17,Ruotsinpyhtää,Finland,Southampton,New York City,1,3,1,Miss,Other,minors,10,0,1.0,0.0,5.0
"Andersson, Miss Ida Augusta Margareta",38,"Vadsbro, Sörmland",Sweden,Southampton,"Manistee, Michigan, US",0,3,0,Miss,Sweden,adults,10,0,0.0,1.0,5.0
"Andersson, Mr. Johan Samuel",26,"Hartford, Connecticut",US,Southampton,"Hartford, Connecticut, US",0,3,0,Mr,US,young adults,10,0,3.0,4.0,6.0
"Andreasson, Mr. Paul Edvin",20,"Kalfsnäs, Småland",Sweden,Southampton,"Chicago, Illinois, US",0,3,0,Mr,Sweden,young adults,1,1,3.0,1.0,6.0
"Angheloff, Mr. Minko",26,"Terziysko, Troyan",Bulgaria,Southampton,"Chicago, Illinois, US",0,3,0,Mr,Other,young adults,1,1,3.0,0.0,6.0
"Arnold-Franchi, Mr. Josef",25,"Altdorf, Uri",Switzerland,Southampton,"New Glarus, Wisconsin, US",0,3,0,Mr,Other,young adults,2,0,3.0,0.0,6.0
"Arnold-Franchi, Mrs. Josefine (née Franchi)",18,"Altdorf, Uri",Switzerland,Southampton,"New Glarus, Wisconsin, US",0,3,0,Mrs,Other,minors,2,0,1.0,0.0,7.0
"Aronsson, Mr. Ernst Axel Algot",24,"Horset, Småland",Sweden,Southampton,"Joliet, Illinois, US",0,3,0,Mr,Sweden,young adults,1,1,3.0,1.0,6.0
"Asim, Mr. Adola",35,Buenos Aires,Argentina,Southampton,New York City,0,3,0,Mr,Other,adults,1,1,0.0,0.0,6.0
"Asplund, Mr. Carl Oscar Vilhelm Gustafsson",40,"Alseda, Småland",Sweden,Southampton,"Worcester, Massachusetts, US",0,3,0,Mr,Sweden,adults,8,0,0.0,1.0,6.0
"Asplund, Mrs. Selma Augusta Emilia (née Johansson)",38,"Alseda, Småland",Sweden,Southampton,"Worcester, Massachusetts, US",1,3,1,Mrs,Sweden,adults,8,0,0.0,1.0,7.0
"Asplund, Master Filip Oscar",13,"Alseda, Småland",Sweden,Southampton,"Worcester, Massachusetts, US",0,3,0,Master,Sweden,minors,8,0,1.0,1.0,4.0
"Asplund, Master Clarence Gustaf Hugo",9,"Alseda, Småland",Sweden,Southampton,"Worcester, Massachusetts, US",0,3,0,Master,Sweden,minors,8,0,1.0,1.0,4.0
"Asplund, Master Carl Edgar",5,"Alseda, Småland",Sweden,Southampton,"Worcester, Massachusetts, US",0,3,0,Master,Sweden,minors,8,0,1.0,1.0,4.0
"Asplund, Miss Lillian Gertrud",5,"Alseda, Småland",Sweden,Southampton,"Worcester, Massachusetts, US",1,3,1,Miss,Sweden,minors,8,0,1.0,1.0,5.0
"Asplund, Master Edvin Rojj Felix",3,"Alseda, Småland",Sweden,Southampton,"Worcester, Massachusetts, US",1,3,1,Master,Sweden,minors,8,0,1.0,1.0,4.0
"Asplund, Mr. Johan Charles",23,"Oskarshamn, Kalmar",Sweden,Southampton,"Minneapolis, Minnesota, US",1,3,1,Mr,Sweden,young adults,8,0,3.0,1.0,6.0
"Assaf, Mrs. Mariyam (née Khalil)",45,Kafr Mishki,Syria,Cherbourg,"Ottawa, Ontario, Canada",1,3,1,Mrs,Syria,adults,1,1,0.0,2.0,7.0
"Assam, Mr. Ali",23,Buenos Aires,Argentina,Southampton,New York City,0,3,0,Mr,Other,young adults,1,1,3.0,0.0,6.0
"Attala, Mr. Sleiman",30,"Ottawa, Ontario",Canada,Cherbourg,"Ottawa, Ontario, Canada",0,3,0,Mr,Other,young adults,1,1,3.0,0.0,6.0
"Atta Allah, Miss Malakah",17,Beirut,Syria,Cherbourg,New York City,0,3,0,Miss,Syria,minors,1,1,1.0,2.0,5.0
"Augustsson, Mr. Albert",23,"Krakoryd, Småland",Sweden,Southampton,"Bloomington, Indiana, US",0,3,0,Mr,Sweden,young adults,1,1,3.0,1.0,6.0
"Ayyub Dahir, Miss Bannurah",15,Beirut,Syria,Cherbourg,"Owen Sound, Ontario, Canada",1,3,1,Miss,Syria,minors,1,1,1.0,2.0,5.0
"Bakus, Mr. Raful",20,Unknown,Syria,Cherbourg,New York City,0,3,0,Mr,Syria,young adults,1,1,3.0,2.0,6.0
"Backström, Mr. Karl Alfred",32,Kotka,Finland,Southampton,New York City,0,3,0,Mr,Other,adults,2,0,0.0,0.0,6.0
"Backström, Mrs. Maria Mathilda (née Gustafsson)[74][94]",33,Kotka,Finland,Southampton,New York City,1,3,1,Mrs,Other,adults,2,0,0.0,0.0,7.0
"Badman, Miss Emily Louisa",18,"Clevedon, North Somerset",UK,Southampton,"Skaneateles, New York, US",1,3,1,Miss,UK,minors,1,1,1.0,3.0,5.0
"Badt, Mr. Mohamed",40,Tripoli,Syria,Cherbourg,New York City,0,3,0,Mr,Syria,adults,1,1,0.0,2.0,6.0
"Bakić, Mr. Kerim",26,Bosanska Krupa,Bosnia,Southampton,"Harrisburg, Pennsylvania, US",0,3,0,Mr,Other,young adults,1,1,3.0,0.0,6.0
"Banski, Mrs. Mara (née Osman)",31,Vagovina,Croatia,Southampton,"Steelton, Pennsylvania, US",1,3,1,Mrs,Other,adults,1,1,0.0,0.0,7.0
"Baqlini, Mrs. Mariyam Latifa (née Qurban)",24,Ḑuhūr ash Shuwayr,Syria,Cherbourg,"Brooklyn, New York, US",1,3,1,Mrs,Syria,young adults,3,0,3.0,2.0,7.0
"Baqlini, Miss Mariya Katarin",5,Ḑuhūr ash Shuwayr,Syria,Cherbourg,"Brooklyn, New York, US",1,3,1,Miss,Syria,minors,3,0,1.0,2.0,5.0
"Baqlini, Miss Eujini",4,Ḑuhūr ash Shuwayr,Syria,Cherbourg,"Brooklyn, New York, US",1,3,1,Miss,Syria,minors,3,0,1.0,2.0,5.0
"Barbarah, Mrs. Katarin Dawud",45,Kafr Mishki,Syria,Cherbourg,"Ottawa, Ontario, Canada",0,3,0,Mrs,Syria,adults,2,0,0.0,2.0,7.0
"Barbarah, Miss Saidah",18,Kafr Mishki,Syria,Cherbourg,"Ottawa, Ontario, Canada",0,3,0,Miss,Syria,minors,2,0,1.0,2.0,5.0
"Barry, Miss Julia",26,"New York City, New York",US,Queenstown,New York City,0,3,0,Miss,US,young adults,1,1,3.0,4.0,5.0
"Barton, Mr. David John",22,"Cambridge, Cambridgeshire",UK,Southampton,New York City,0,3,0,Mr,UK,young adults,1,1,3.0,3.0,6.0
"Beavan, Mr. William Thomas",18,"Fillingham, Lincolnshire",UK,Southampton,"Russell, US",0,3,0,Mr,UK,minors,1,1,1.0,3.0,6.0
"Bengtsson, Mr. Johan Viktor",26,"Fridhemsberg, Halland",Sweden,Southampton,"Monee, Illinois, US",0,3,0,Mr,Sweden,young adults,1,1,3.0,1.0,6.0
"Berglund, Mr. Karl Ivar Sven",22,Firtby,Finland,Southampton,New York City,0,3,0,Mr,Other,young adults,1,1,3.0,0.0,6.0
"Betros, Mr. Tannous",20,Zgharta,Syria,Cherbourg,"Waterbury, Connecticut, US",0,3,0,Mr,Syria,young adults,1,1,3.0,2.0,6.0
"Birkeland, Mr. Hans Martin Monsen",21,Bremnes,Norway,Southampton,New York City,0,3,0,Mr,Other,young adults,1,1,3.0,0.0,6.0
"Björklund, Mr. Ernst Herbert",18,Stockholm,Sweden,Southampton,New York City,0,3,0,Mr,Sweden,minors,1,1,1.0,1.0,6.0
"Bostandyeff, Mr. Guentcho",26,Unknown,Bulgaria,Southampton,"Chicago, Illinois, US",0,3,0,Mr,Other,young adults,1,1,3.0,0.0,6.0
"Bourke, Mr. John",42,"Carrowskehine, Mayo",UK,Queenstown,"Chicago, Illinois, US",0,3,0,Mr,UK,adults,3,0,0.0,3.0,6.0
"Bourke, Mrs. Catherine (née McHugh)",32,"Carrowskehine, Mayo",UK,Queenstown,"Chicago, Illinois, US",0,3,0,Mrs,UK,adults,3,0,0.0,3.0,7.0
"Bourke, Miss Mary",40,"Carrowskehine, Mayo",UK,Queenstown,"Chicago, Illinois, US",0,3,0,Miss,UK,adults,3,0,0.0,3.0,5.0
"Bowen, Mr. David John ""Dai""",20,"Treherbert, Glamorgan",UK,Southampton,New York City,0,3,0,Mr,UK,young adults,1,1,3.0,3.0,6.0
"Bradley, Miss Bridget Delia",22,"Kingwilliamstown, Cork",UK,Queenstown,"Glen Falls, New York, US",1,3,1,Miss,UK,young adults,1,1,3.0,3.0,5.0
"Braf, Miss Elin Ester Maria",20,"Medeltorp, Småland",Sweden,Southampton,"Chicago, Illinois, US",0,3,0,Miss,Sweden,young adults,1,1,3.0,1.0,5.0
"Braund, Mr. Lewis Richard",29,"Bridgerule, Devon",UK,Southampton,"Qu'Appelle Valley, Saskatchewan, Canada",0,3,0,Mr,UK,young adults,2,0,3.0,3.0,6.0
"Braund, Mr. Owen Harris",22,"Bridgerule, Devon",UK,Southampton,"Qu'Appelle Valley, Saskatchewan, Canada",0,3,0,Mr,UK,young adults,2,0,3.0,3.0,6.0
"Brobeck, Mr. Karl Rudolf",22,"Norrköping, Östergötland",Sweden,Southampton,"Worcester, Massachusetts, US",0,3,0,Mr,Sweden,young adults,1,1,3.0,1.0,6.0
"Brocklebank, Mr. William Alfred",35,"Broomfield, Essex",UK,Southampton,New York City,0,3,0,Mr,UK,adults,1,1,0.0,3.0,6.0
"Buckley, Mr. Daniel",21,"Kingwilliamstown, Cork",UK,Queenstown,New York City,1,3,1,Mr,UK,young adults,2,0,3.0,3.0,6.0
"Buckley, Miss Catherine",22,"Ovens, Cork",UK,Queenstown,"Roxbury, Massachusetts, US",0,3,0,Miss,UK,young adults,2,0,3.0,3.0,5.0
"Bulus, Mrs. Sultanah (née Rizq)",40,Unknown,Syria,Cherbourg,"Kent, British Columbia, Canada",0,3,0,Mrs,Syria,adults,3,0,0.0,2.0,7.0
"Bulus, Master Akar",9,Unknown,Syria,Cherbourg,"Kent, British Columbia, Canada",0,3,0,Master,Syria,minors,3,0,1.0,2.0,4.0
"Bulus, Miss Nur-al-Ayn",7,Unknown,Syria,Cherbourg,"Kent, British Columbia, Canada",0,3,0,Miss,Syria,minors,3,0,1.0,2.0,5.0
"Burke, Mr. Jeremiah",19,"Glanmire, Cork",UK,Queenstown,"Charlestown, US",0,3,0,Mr,UK,young adults,1,1,3.0,3.0,6.0
"Burns, Miss Mary Delia",17,"Kilmacowen, Sligo",UK,Queenstown,New York City,0,3,0,Miss,UK,minors,1,1,1.0,3.0,5.0
"Butrus-Youssef, Mrs. Katarin (née Rizk)",24,Sar'al[95],Syria,Cherbourg,"Detroit, Michigan, US",1,3,1,Mrs,Syria,young adults,3,0,3.0,2.0,7.0
"Butrus-Youssef, Master Makhkhul",4,Sar'al[95],Syria,Cherbourg,"Detroit, Michigan, US",1,3,1,Master,Syria,minors,3,0,1.0,2.0,4.0
"Butrus-Youssef, Miss Marianna",2,Sar'al[95],Syria,Cherbourg,"Detroit, Michigan, US",1,3,1,Miss,Syria,minors,3,0,1.0,2.0,5.0
"Čačić, Mr. Jego Grga",18,Široka Kula,Croatia,Southampton,"Chicago, Illinois, US",0,3,0,Mr,Other,minors,4,0,1.0,0.0,6.0
"Čačić, Mr. Luka",38,Široka Kula,Croatia,Southampton,"Chicago, Illinois, US",0,3,0,Mr,Other,adults,4,0,0.0,0.0,6.0
"Čačić, Miss Marija",30,Široka Kula,Croatia,Southampton,"Chicago, Illinois, US",0,3,0,Miss,Other,young adults,4,0,3.0,0.0,5.0
"Čačić, Miss Manda",21,Široka Kula,Croatia,Southampton,"Chicago, Illinois, US",0,3,0,Miss,Other,young adults,4,0,3.0,0.0,5.0
"Čalić, Mr. Jovo",17,Brezik,Croatia,Southampton,"Sault Ste. Marie, Michigan, US",0,3,0,Mr,Other,minors,2,0,1.0,0.0,6.0
"Čalić, Mr. Petar",17,Brezik,Croatia,Southampton,"Sault Ste. Marie, Michigan, US",0,3,0,Mr,Other,minors,2,0,1.0,0.0,6.0
"Canavan, Miss Mary",22,"Tonacrick, Clare",UK,Queenstown,"Philadelphia, Pennsylvania, US",0,3,0,Miss,UK,young adults,2,0,3.0,3.0,5.0
"Canavan, Mr. Patrick ""Peter""",21,"Knockmaria, Mayo",UK,Queenstown,"Philadelphia, Pennsylvania, US",0,3,0,Mr,UK,young adults,2,0,3.0,3.0,6.0
"Cann, Mr. Ernest Charles",21,"Penwithick, Cornwall",UK,Southampton,New York City,0,3,0,Mr,UK,young adults,1,1,3.0,3.0,6.0
"Caram, Mr. Joseph",28,Kfar Mechi,Syria,Cherbourg,"Ottawa, Ontario, Canada",0,3,0,Mr,Syria,young adults,2,0,3.0,2.0,6.0
"Caram, Mrs. Maria (née Elias)",18,Kfar Mechi,Syria,Cherbourg,"Ottawa, Ontario, Canada",0,3,0,Mrs,Syria,minors,2,0,1.0,2.0,7.0
"Carlsson, Mr. Carl Robert",24,"Göteborg, Västergötland",Sweden,Southampton,"Huntley, Illinois, US",0,3,0,Mr,Sweden,young adults,2,0,3.0,1.0,6.0
"Carlsson, Mr. August Sigfrid",24,"Dagsås, Halland",Sweden,Southampton,"Tower, Minnesota, US",0,3,0,Mr,Sweden,young adults,2,0,3.0,1.0,6.0
"Carr, Miss Jane",47,"Aclare, Sligo",UK,Queenstown,"Hartford, Connecticut, US",0,3,0,Miss,UK,adults,1,1,0.0,3.0,5.0
"Carver, Mr. Alfred John",28,"Southampton, Hampshire",UK,Southampton,New York City,0,3,0,Mr,UK,young adults,1,1,3.0,3.0,6.0
"Chang, Mr. Chip",32,Hong Kong,China,Southampton,New York City,1,3,1,Mr,Other,adults,1,1,0.0,0.0,6.0
"Charters, Mr. David",28,"Ballinalee, Longford",UK,Queenstown,New York City,0,3,0,Mr,UK,young adults,1,1,3.0,3.0,6.0
"Cheong, Mr. Foo",32,Hong Kong,China,Southampton,New York City,1,3,1,Mr,Other,adults,1,1,0.0,0.0,6.0
"Christmann, Mr. Emil",29,London,UK,Southampton,New York City,0,3,0,Mr,UK,young adults,1,1,3.0,3.0,6.0
"Chronopoulos, Mr. Apostolos",26,"Agios Sostis, Peloponnese",Greece,Cherbourg,New York City,0,3,0,Mr,Other,young adults,2,0,3.0,0.0,6.0
"Chronopoulos, Mr. Dimitrios",18,"Agios Sostis, Peloponnese",Greece,Cherbourg,New York City,0,3,0,Mr,Other,minors,2,0,1.0,0.0,6.0
"Coelho, Mr. Domingos Fernandes",20,"Funchal, Madeira Islands",Portugal,Southampton,New York City,0,3,0,Mr,Other,young adults,1,1,3.0,0.0,6.0
"Cohen, Mr. Gershon ""Gus""",18,London,UK,Southampton,"Brooklyn, New York, US",1,3,1,Mr,UK,minors,1,1,1.0,3.0,6.0
"Colbert, Mr. Patrick",24,"Kilkinlea, Limerick",UK,Queenstown,"Sherbrooke, Quebec, Canada",0,3,0,Mr,UK,young adults,1,1,3.0,3.0,6.0
"Coleff, Mr. Fotio",24,"Debnevo, Troyan",Bulgaria,Southampton,"Chicago, Illinois, US",0,3,0,Mr,Other,young adults,1,1,3.0,0.0,6.0
"Coltcheff, Mr. Peju",36,"Gumostnik, Lovec",Bulgaria,Southampton,"Chicago, Illinois, US",0,3,0,Mr,Other,adults,1,1,0.0,0.0,6.0
"Conlon, Mr. Thomas Henry",31,"Philadelphia, Pennsylvania",US,Queenstown,"Philadelphia, Pennsylvania, US",0,3,0,Mr,US,adults,1,1,0.0,4.0,6.0
"Connaghton, Mr. Michael",31,"Brooklyn, New York",US,Queenstown,"Brooklyn, New York, US",0,3,0,Mr,US,adults,1,1,0.0,4.0,6.0
"Connolly, Miss Catherine ""Kate""",35,"Bank Place, Tipperary",UK,Queenstown,"Dobbs Ferry, New York, US",0,3,0,Miss,UK,adults,2,0,0.0,3.0,5.0
"Connolly, Miss Katherine ""Kate""",22,"Cortrasna, Cavan",UK,Queenstown,New York City,1,3,1,Miss,UK,young adults,2,0,3.0,3.0,5.0
"Connors, Mr. Patrick John",61,"Charleville, Cork",UK,Queenstown,New York City,0,3,0,Mr,UK,seniors,1,1,2.0,3.0,6.0
"Cook, Mr. Jacob(Kukk, Mr. Jakob?)",43,Unknown(Estonia?),Russia,Southampton,New York City,0,3,0,Mr,Other,adults,1,1,0.0,0.0,6.0
"Čor, Mr. Bartol",35,Kricina,Croatia,Southampton,"Great Falls, Montana, US",0,3,0,Mr,Other,adults,3,0,0.0,0.0,6.0
"Čor, Mr. Ivan",27,Kricina,Croatia,Southampton,"Great Falls, Montana, US",0,3,0,Mr,Other,young adults,3,0,3.0,0.0,6.0
"Čor, Mr. Liudevit",19,Kricina,Croatia,Southampton,"Great Falls, Montana, US",0,3,0,Mr,Other,young adults,3,0,3.0,0.0,6.0
"Corn, Mr. Henry ""Harry""",30,London,UK,Southampton,New York City,0,3,0,Mr,UK,young adults,1,1,3.0,3.0,6.0
"Corr, Miss Helen",16,"Corglass, Longford",UK,Queenstown,New York City,1,3,1,Miss,UK,minors,1,1,1.0,3.0,5.0
"Coutts, Mrs. Mary Winnie (née Trainer)",36,London,UK,Southampton,"Brooklyn, New York, US",1,3,1,Mrs,UK,adults,3,0,0.0,3.0,7.0
"Coutts, Master William Loch ""Willie""",9,London,UK,Southampton,"Brooklyn, New York, US",1,3,1,Master,UK,minors,3,0,1.0,3.0,4.0
"Coutts, Master Neville Leslie",3,London,UK,Southampton,"Brooklyn, New York, US",1,3,1,Master,UK,minors,3,0,1.0,3.0,4.0
"Coxon, Mr. Daniel",59,London,UK,Southampton,"Merrill, Wisconsin, US",0,3,0,Mr,UK,seniors,1,1,2.0,3.0,6.0
"Crease, Mr. Ernest James",19,"Bristol, Avon",UK,Southampton,"Cleveland, Ohio, US",0,3,0,Mr,UK,young adults,1,1,3.0,3.0,6.0
"Cribb, Mr. John Hatfield",44,"Bournemouth, Dorset",UK,Southampton,"Newark, New Jersey, US",0,3,0,Mr,UK,adults,2,0,0.0,3.0,6.0
"Cribb, Miss Laura Mae",16,"Bournemouth, Dorset",UK,Southampton,"Newark, New Jersey, US",1,3,1,Miss,UK,minors,2,0,1.0,3.0,5.0
"Cui, Mr. Owen",16,Hong Kong,China,Southampton,New York City,0,3,0,Mr,Other,minors,1,1,1.0,0.0,6.0
"Čulumović, Mr. Jeso",17,Lipova Glavica,Croatia,Southampton,"Hammond, Indiana, US",0,3,0,Mr,Other,minors,1,1,1.0,0.0,6.0
"Dahir, Mr. Tannous",28,Beirut,Syria,Cherbourg,"Youngstown, Ohio, US",0,3,0,Mr,Syria,young adults,1,1,3.0,2.0,6.0
"Dahl, Mr. Charles Edwart",45,"Adelaide, South Australia",Australia,Southampton,"Fingal, North Dakota, US",1,3,1,Mr,Other,adults,1,1,0.0,0.0,6.0
"Dahlberg, Miss Gerda Ulrika",22,Stockholm,Sweden,Southampton,"Chicago, Illinois, US",0,3,0,Miss,Sweden,young adults,1,1,3.0,1.0,5.0
"Dakić, Mr. Branko",19,Gornji Miholjac,Croatia,Southampton,New York City,0,3,0,Mr,Other,young adults,1,1,3.0,0.0,6.0
"Daly, Miss Margaret ""Maggie""",30,"Athlone, Westmeath",UK,Queenstown,New York City,1,3,1,Miss,UK,young adults,2,0,3.0,3.0,5.0
"Daly, Mr. Eugene Patrick",29,"Athlone, Westmeath",UK,Queenstown,New York City,1,3,1,Mr,UK,young adults,2,0,3.0,3.0,6.0
"Danbom, Mr. Ernst Gilbert",34,"Göteborg, Västergötland",Sweden,Southampton,"Stanton, Iowa, US",0,3,0,Mr,Sweden,adults,2,0,0.0,1.0,6.0
"Danbom, Mrs. Anna Sigrid Maria (née Brogren)",28,"Göteborg, Västergötland",Sweden,Southampton,"Stanton, Iowa, US",0,3,0,Mrs,Sweden,young adults,2,0,3.0,1.0,7.0
